{"$schema":"https://json-schema.org/draft/2020-12/schema","title":"Tau DAG source reference v1","type":"object","required":["schema","source_schema","source_sha256","canonical_source_path","original_source_path","written_at"],"properties":{"schema":{"const":"tau.dag_source_reference.v1"},"source_schema":{"type":"string"},"source_sha256":{"pattern":"^sha256:[0-9a-f]{64}$"},"canonical_source_path":{"const":"source-dag.json"},"original_source_path":{"type":"string"},"written_at":{"type":"string"}},"additionalProperties":false}
