{"canonical_source_path":"source-dag.json","original_source_path":"/tmp/tau-issue186-1785164636/docs/proofs/tickets/issue-186-canonical-scheduler-conformance-v3-20260727/runs/canonical-02/dag.json","schema":"tau.dag_source_reference.v1","source_schema":"tau.generic_dag_spec.v1","source_sha256":"sha256:f3efd25bab610f80aa90f183dfd67fe04c6326f43fa440e4e3651e611fee76cf","written_at":"2026-07-27T15:14:58.781970Z"}
