{"canonical_source_path":"source-dag.json","original_source_path":"/tmp/tau-issue189-1785166987/docs/proofs/tickets/issue-186-canonical-scheduler-conformance-20260727/runs/skill-node/skill-node.json","schema":"tau.dag_source_reference.v1","source_schema":"tau.generic_dag_spec.v1","source_sha256":"sha256:c721de40003c4f0a709168a2ebd873ea5b983ff2b661faf868e0769f0f8670ba","written_at":"2026-07-27T16:49:17.375502Z"}
